"Project Title","Principal Investigator","Co-Principal Investigators","Related to Project"
"BCSP: Collaborative Research: ABI Development: Exploring Taxon Concepts (ETC) through analysing fine-grained semantic markup of descriptive literature","Bertram Ludaescher","None"
"Mammalian Diversity in Bolivia - The Yungas and Valles","Terry Yates","None"
"MII: Infrastructure for Research and Training in Database Management for Web-based Geospatial Data Visualization with Applications to Aviation","Naphtali Rishe","Ben Wongsaroj"
"West Nile virus: Eco-epidemiology of disease emergence in urban areas II","Tony Goldberg","Uriel Kitron, Jeffrey Brawn, Marilyn Ruiz, Edward Walker"
"Microstructural analyses of gouge from the San Andreas Fault Observatory at Depth (SAFOD) borehole in relation to brittle fault mechanics: A collaborative study","Jafar Hadizadeh","Giulio DiToro, Hassan Babaie, Karen Mair"
"Ecological Modeling: From Individual Utilization of Space to Community Structure","George Cosner","Robert Cantrell"
"Collaborative Research: Data Integration for Repository Services in Biodiversity Informatics","James Beach","NoneAustin Mast"
"BE/CBC: Biocomplexity Associated with the Response of Tundra Carbon Balance to Warming and Drying Across Multiple Spatial and Temporal Scales","Walter Oechel","Craig Tweedie, John Kimball"
"EID: Roles of a marine host cycle and particle aggregation in transmission of zoonotic pathogens in coastal ecosystems","Patricia Conrad","Christine Johnson, Woutrina Miller, John Largier"
"LTER: Biome-level Constraints on Population, Community, and Ecosystem Responses to Climate Fluctuation, Sevilleta LTER II","James Gosz","Ann Evans, Donald Duszynski, James Brown, Terry Yates"
